package,bundle,main_object,role,description_bundle,source,variables,auxiliary_files,n,k,analytical_variables,identifier_variables,has_geometry,has_coordinates,coordinate_columns,has_multiple_x,candidate_x_variables,candidate_y_variables,target_status,formula_text,has_referenced_paper,paper_doi,paper_doi_status,paper_title,paper_use_summary,paper_model_keywords,paper_formula_or_equation,paper_variables_used,paper_related_datasets,paper_reference_evidence,paper_evidence_status,has_place_name_if_no_geometry,place_name_columns,datetime_columns,theme,analytical_group,linked_datasets,group_has_y,group_y_variables,group_x_variables,duplicate_key,duplicate_status,final_category,usage_role,classification_reason,famille_geometrie,geom_type_origine,modalite_spatiale,modalite_provenance,a_variable_T,has_formule,variable_reponse_principale,reponse_candidats,type_reponse,paper_source_kg,has_formule_modele,formule_modele,formule_contexte,formule_graphe_ignoree,formule_doc_source
ade4,atya,atya,observation_collection,Genetic variability of Cacadors,"Fievet, E., Eppe, F. and Dol<c3><a9>dec, S. (2001) Etude de la variabilit<c3><a9> morphom<c3><a9>trique et g<c3><a9>n<c3><a9>tique des populations de Cacadors (_Atya innocous_ et _Atya scabra_) de l'<c3><ae>le de Basse-Terre. Direction R<c3><a9>gionale de L'Environnement Guadeloupe, Laboratoire des hydrosyst<c3><a8>mes fluviaux, Universit<c3><a9> Lyon 1.","x, y, Fbp100, Fbp155, Gpi52, Gpi72, Gpi100, Gpi126, Gpi143, Mdh1.15, Mdh1.100, Mdh2.50, Mdh2.80, Mdh2.100, Mdh2.115, Mdhp60, Mdhp84, Mdhp100, Mdhp140, Pgm88, Pgm91, Pgm98, Pgm100, Pgm180",,31,22,"Fbp100, Fbp155, Gpi52, Gpi72, Gpi100, Gpi126, Gpi143, Mdh1.15, Mdh1.100, Mdh2.50, Mdh2.80, Mdh2.100, Mdh2.115, Mdhp60, Mdhp84, Mdhp100, Mdhp140, Pgm88, Pgm91, Pgm98, Pgm100, Pgm180",,Yes,Yes,"x, y",Yes,"Fbp100, Fbp155, Gpi52, Gpi72, Gpi100, Gpi126, Gpi143, Mdh1.15, Mdh1.100, Mdh2.50, Mdh2.80, Mdh2.100, Mdh2.115, Mdhp60, Mdhp84, Mdhp100, Mdhp140, Pgm88, Pgm91, Pgm98, Pgm100, Pgm180",(multivarié — pas de réponse univariée),unknown,,No,,,,,,,,,,rd_reference_only,No,,,a qualifier manuellement,ade4::bundle::atya,atya,No,,"Fbp100, Fbp155, Gpi52, Gpi72, Gpi100, Gpi126, Gpi143, Mdh1.15, Mdh1.100, Mdh2.50, Mdh2.80, Mdh2.100, Mdh2.115, Mdhp60, Mdhp84, Mdhp100, Mdhp140, Pgm88, Pgm91, Pgm98, Pgm100, Pgm180",atya::geneticvariabilityofcacadors,unique,Bons candidats spatial,spatial_model_candidate,geometrie ou coordonnees directes et variables analytiques suffisantes,point,POINT,point,index_sf:join_direct,FALSE,FALSE,,,inconnu,,FALSE,,,,wiki/datasets/r_package_docs/ade4/topics/atya.md
ade4,avijons,avijons,observation_collection,Bird species distribution,"Bournaud, M., Amoros, C., Chessel, D., Coulet, M., Doledec, S., Michelot, J.L., Pautou, G., Rostan, J.C., Tachet, H. and Thioulouse, J. (1990). _Peuplements d'oiseaux et propri<c3><a9>t<c3><a9>s des <c3><a9>cocomplexes de la plaine du Rh<c3><b4>ne : descripteurs de fonctionnement global et gestion des berges._ Rapport programme S.R.E.T.I.E., Minist<c3><a8>re de l'Environnement CORA et URA CNRS 367, Univ. Lyon I.","x, y, T1, T2, T3, T4, T5, T6, T7, T8, T9, T10, T11, T12, T13, T14, T15, T16, T17, T18, T19, T20, T21, T22, T23, T24, T25, T26, T27, T28, T29, T30, T31, T32, T33, T34, T35, T36, T37, T38, T39, T40, T41, T42, T43, T44, T45, T46, T47, T48, T49, T50, T51, T52, T53, T54, T55, T56, T57, T58, T59, T60, T61, T62, T63, T64",,91,64,"T1, T2, T3, T4, T5, T6, T7, T8, T9, T10, T11, T12, T13, T14, T15, T16, T17, T18, T19, T20, T21, T22, T23, T24, T25, T26, T27, T28, T29, T30, T31, T32, T33, T34, T35, T36, T37, T38, T39, T40, T41, T42, T43, T44, T45, T46, T47, T48, T49, T50, T51, T52, T53, T54, T55, T56, T57, T58, T59, T60, T61, T62, T63, T64",,Yes,Yes,"x, y",Yes,"T1, T2, T3, T4, T5, T6, T7, T8, T9, T10, T11, T12, T13, T14, T15, T16, T17, T18, T19, T20, T21, T22, T23, T24, T25, T26, T27, T28, T29, T30, T31, T32, T33, T34, T35, T36, T37, T38, T39, T40, T41, T42, T43, T44, T45, T46, T47, T48, T49, T50, T51, T52, T53, T54, T55, T56, T57, T58, T59, T60, T61, T62, T63, T64",(multivarié — pas de réponse univariée),unknown,,No,,,,,,,,,,rd_reference_only,No,,,biodiversite / ecologie,ade4::bundle::avijons,avijons,No,,"T1, T2, T3, T4, T5, T6, T7, T8, T9, T10, T11, T12, T13, T14, T15, T16, T17, T18, T19, T20, T21, T22, T23, T24, T25, T26, T27, T28, T29, T30, T31, T32, T33, T34, T35, T36, T37, T38, T39, T40, T41, T42, T43, T44, T45, T46, T47, T48, T49, T50, T51, T52, T53, T54, T55, T56, T57, T58, T59, T60, T61, T62, T63, T64",avijons::birdspeciesdistribution,unique,Bons candidats spatial,spatial_model_candidate,geometrie ou coordonnees directes et variables analytiques suffisantes,point,POINT,point,index_sf:join_direct,FALSE,FALSE,,,inconnu,,FALSE,,,,wiki/datasets/r_package_docs/ade4/topics/avijons.md
ade4,buech,buech,observation_collection,Buech basin,"Vespini, F. (1985) _Contribution <c3><a0> l'<c3><a9>tude hydrobiologique du Buech, rivi<c3><a8>re non am<c3><a9>nag<c3><a9>e de Haute-Provence_. Th<c3><a8>se de troisi<c3><a8>me cycle, Universit<c3><a9> de Provence. Vespini, F., L<c3><a9>gier, P. and Champeau, A. (1987) Ecologie d'une rivi<c3><a8>re non am<c3><a9>nag<c3><a9>e des Alpes du Sud : Le Bu<c3><ab>ch (France) I. Evolution longitudinale des descripteurs physiques et chimiques. _Annales de Limnologie_, *23*, 151-164.","pH, Conductivity, Carbonate, hardness, Bicarbonate, Chloride, Suspens, Organic, Nitrate, Ammonia, pH_1, Conductivity_1, Carbonate_1, hardness_1, Bicarbonate_1, Chloride_1, Suspens_1, Organic_1, Nitrate_1, Ammonia_1, x, y",,31,20,"pH, Conductivity, Carbonate, hardness, Bicarbonate, Chloride, Suspens, Organic, Nitrate, Ammonia, pH_1, Conductivity_1, Carbonate_1, hardness_1, Bicarbonate_1, Chloride_1, Suspens_1, Organic_1, Nitrate_1, Ammonia_1",,Yes,Yes,"x, y",Yes,"pH, Conductivity, Carbonate, hardness, Bicarbonate, Chloride, Suspens, Organic, Nitrate, Ammonia, pH_1, Conductivity_1, Carbonate_1, hardness_1, Bicarbonate_1, Chloride_1, Suspens_1, Organic_1, Nitrate_1, Ammonia_1",(multivarié — pas de réponse univariée),unknown,,No,,,,,,,,,,rd_reference_only,No,,,a qualifier manuellement,ade4::bundle::buech,buech,No,,"pH, Conductivity, Carbonate, hardness, Bicarbonate, Chloride, Suspens, Organic, Nitrate, Ammonia, pH_1, Conductivity_1, Carbonate_1, hardness_1, Bicarbonate_1, Chloride_1, Suspens_1, Organic_1, Nitrate_1, Ammonia_1",buech::buechbasin,unique,Bons candidats spatial,spatial_model_candidate,geometrie ou coordonnees directes et variables analytiques suffisantes,point,POINT,point,index_sf:join_direct,FALSE,FALSE,,,inconnu,,FALSE,,,,wiki/datasets/r_package_docs/ade4/topics/buech.md
ade4,butterfly,butterfly,observation_collection,Genetics-Ecology-Environment Triple,"McKechnie, S.W., Ehrlich, P.R. and White, R.R. (1975). Population genetics of Euphydryas butterflies. I. Genetic variation and the neutrality hypothesis. _Genetics_, *81*, 571-594.","x, y, Altitude, Precipitation, Temp_Max, Temp_Min, 0.4, 0.6, 0.8, 1, 1.16, 1.3",,16,10,"Altitude, Precipitation, Temp_Max, Temp_Min, 0.4, 0.6, 0.8, 1, 1.16, 1.3",,Yes,Yes,"x, y",Yes,"Altitude, Precipitation, Temp_Max, Temp_Min, 0.4, 0.6, 0.8, 1, 1.16, 1.3",(multivarié — pas de réponse univariée),unknown,,No,,,,,,,,,,rd_reference_only,No,,,biodiversite / ecologie,ade4::bundle::butterfly,butterfly,No,,"Altitude, Precipitation, Temp_Max, Temp_Min, 0.4, 0.6, 0.8, 1, 1.16, 1.3",butterfly::geneticsecologyenvironmenttriple,unique,Bons candidats spatial,spatial_model_candidate,geometrie ou coordonnees directes et variables analytiques suffisantes,point,POINT,point,index_sf:join_direct,FALSE,FALSE,,,inconnu,,FALSE,,,,wiki/datasets/r_package_docs/ade4/topics/butterfly.md
ade4,chevaine,chevaine,observation_collection,Enzymatic polymorphism in Leuciscus cephalus,,"PGM-2*.090, PGM-2*.098, PGM-2*.100, IDHP-1*.100, IDHP-1*.145, EST-2*.098, EST-2*.100, G3PDH*.085, G3PDH*.100, x, y, eff",,27,10,"PGM-2*.090, PGM-2*.098, PGM-2*.100, IDHP-1*.100, IDHP-1*.145, EST-2*.098, EST-2*.100, G3PDH*.085, G3PDH*.100, eff",,Yes,Yes,"x, y",Yes,"PGM-2*.090, PGM-2*.098, PGM-2*.100, IDHP-1*.100, IDHP-1*.145, EST-2*.098, EST-2*.100, G3PDH*.085, G3PDH*.100, eff",(multivarié — pas de réponse univariée),unknown,,Yes,,unknown_not_found,") Spatial aspects of genetic differentiation of the European chub in the Rhone River basin. _Journal of Fish Biology_, *49*, 714-726. See a data description at <http://pbil.univ...","Referenced work: ) Spatial aspects of genetic differentiation of the European chub in the Rhone River basin. _Journal of Fish Biology_, *49*, 714-726. See a data description at <http://pbil.univ....",,,,,"Guinand B., Bouvet Y. and Brohon B. (1996) Spatial aspects of genetic differentiation of the European chub in the Rhone River basin. _Journal of Fish Biology_, *49*, 714-726. See a data description at <http://pbil.univ-lyon1.fr/R/pdf/pps054.pdf> (in French).",rd_reference_only,No,,,a qualifier manuellement,ade4::paper::unknown_not_found,"acacia, aviurba, carniherbi49, chevaine, fission, irishdata, julliot, macaca, olympic, pcw, piosphere, santacatalina, skulls, steppe, tarentaise, vegtf, yanomama",Yes,"species.family, sales, sales_1, Poptr","se.T1, se.T2, se.T3, se.T4, se.T5, sm.T1, sm.T2, sm.T3, sm.T4, sm.T5, la.T1, la.T2, la.T3, la.T4, la.T5, feed.hab, feed.strat, breeding, migratory, fam, ord, bodymass, homerange, clade, runningspeed, bodymass_1, hindlength, mtfratio, PGM-2*.090, PGM-2*.098, PGM-2*.100, IDHP-1*.100, IDHP-1*.145, EST-2*.098, EST-2*.100, G3PDH*.085, G3PDH*.100, eff, GM1, GM2, GM3, GN1, GN2, T0.10, T10.50, Tup50, cow, other, pig, sheep, car, radio, single.man, S01, S02, S03, S04, S05, S06, S07, S08, S09, S10, S11, S12, S13, S14, S15, S16, S17, S18, S19, S20, S21, S22, S23, S24, S25, V1, V2, Carlow, Cavan, Clare, Cork, Donegal, Galway, Kerry, Kildare, Kilkenny, Laoghis, Leitrim, Limerick, Longford, Louth, Mayo, Meath, Monaghan, Offaly, Roscommon, Sligo, Tipperary, Waterford, Westmeath, Wexford, Wicklow, T0.10_1, T10.50_1, Tup50_1, cow_1, other_1, pig_1, sheep_1, car_1, radio_1, single.man_1, Pouteria_torta, Minquartia_guianensis, Quiina_obovata, Chrysophyllum_lucentifolium, Parahancornia_fasciculata, Virola_michelii, Pourouma_spp, V1_1, V2_1, 100, long, poid, haut, 400, 110, disq, perc, jave, 1500, score, V3, V4, V5, V6, V7, V8, V9, V10, V11, V12, V13, V14, V15, V16, V17, V18, V19, V20, V21, V22, V23, V24, V25, V26, V27, V28, V29, V30, V31, V32, V33, V34, V35, V36, V37, V38, V39, V40, V41, V42, V43, V44, V45, V46, V47, V48, V49, V50, V51, V52, V53, V54, V55, V56, V57, V58, V59, V60, V61, V62, V63, V64, V65, V66, V67, V68, V69, V70, V71, V72, V73, V74, V75, V76, V77, V78, V79, V80, V81, V82, V83, V84, V85, V86, V87, V88, V89, V90, V91, V92, V93, V94, V95, V96, V97, V98, V99, V100, V101, V102, V103, V104, V105, V106, V107, V108, V109, V110, V111, V112, V113, V114, V115, V116, V117, V118, V119, V120, V121, V122, V123, V124, V125, V126, V127, V128, V129, V130, V131, V132, V133, V134, V135, V136, V137, V138, V139, V140, V141, V142, V143, V144, V145, V146, V147, V148, V149, V150, V151, V152, V153, V154, V155, V156, V157, V158, V159, V160, V161, V162, V163, V164, V165, V166, V167, V168, V169, V170, V171, V172, V173, V174, V175, V176, V177, V178, V179, V180, V181, V182, V183, V184, V185, V186, V187, V188, V189, V190, V191, V192, V193, V194, V195, V196, V197, V198, V199, V200, V201, V202, V203, V204, V205, V206, V207, V208, V209, V210, V211, V212, V213, V214, V215, V216, V217, V218, V219, V220, V221, V222, V223, V224, V225, V226, V227, V228, V229, V230, V231, V232, V233, V234, V235, V236, V237, V238, V239, V240, V241, V242, V243, V244, V245, V246, V247, V248, V249, V250, V251, V252, V253, V254, V255, V256, V257, V258, V259, V260, V261, V262, V263, V264, V265, V266, V267, V268, V269, V270, V271, V272, V273, V274, V275, V276, V277, V278, V279, V280, V281, V282, V283, V284, V285, V286, V287, V288, V289, V290, V291, V292, V293, V294, V295, V296, V297, V298, V299, V300, V301, V302, V303, V304, V305, V306, V307, V308, V309, V310, V311, V312, V313, V314, V315, V316, V317, V318, V319, V320, V321, V322, V323, V324, V325, V326, V327, V328, V329, V330, V331, V332, V333, V334, V335, V336, V337, V338, V339, V340, V341, V342, V343, V344, V345, V346, V347, V348, V349, V350, V351, V352, V353, V354, V355, V356, V357, V358, V359, V360, V361, V362, V363, V364, V365, V366, V367, V368, V369, V370, V371, V372, V373, V374, V375, V376, V377, V378, V379, V380, V381, V382, V383, V384, V385, V386, V387, V388, V389, V390, V391, V392, V393, V394, V395, V396, V397, V398, V399, V400, V401, V402, V403, V404, V405, V406, V407, V408, V409, V410, V411, V412, V413, V414, V415, V416, V417, V418, V419, V420, V421, V422, V423, V424, V425, V426, V427, V428, V429, V430, V431, V432, V433, V434, V435, V436, V437, V438, V439, V440, V441, V442, V443, V444, V445, V446, V447, V448, V449, V450, V451, V452, V453, V454, V455, V456, V457, V458, V459, V460, V461, V462, V463, V464, V465, V466, V467, V468, V469, V470, V471, V472, V473, V474, V475, V476, V477, V478, V479, V480, V481, V482, V483, V484, V485, V486, V487, V488, V489, V490, V491, V492, V493, V494, V495, V496, V497, V498, V499, V500, V501, V502, V503, V504, V505, V506, V507, V508, V509, V510, V511, V512, V513, V514, V515, V516, V517, V518, V519, V520, V521, V522, V523, V524, V525, V526, V527, V528, V529, V530, V531, V532, V533, V534, V535, V536, V537, V538, V539, V540, V541, V542, V543, V544, V545, V546, V547, V548, V549, V550, V551, V552, V553, V554, V555, V556, V557, V558, V559, V560, V561, V562, V563, V564, V565, V566, V567, V568, V569, V570, V571, V572, V573, V574, V575, V576, V577, V578, V579, V580, V581, V582, V583, V584, V585, V586, V587, V588, V589, V590, V591, V592, V593, V594, V595, V596, V597, V598, V599, V600, V601, V602, V603, V604, V605, V606, V607, V608, V609, V610, V611, V612, V613, V614, V615, V616, V617, V618, V619, V620, V621, V622, V623, V624, V625, V626, V627, V628, V629, V630, V631, V632, V633, V634, V635, V636, V637, V638, V639, V640, V641, V642, V643, V644, V645, V646, V647, V648, V649, V650, V651, V652, V653, V654, V655, V656, V657, V658, V659, V660, V661, V662, V663, V664, V665, V666, V667, V668, V669, V670, V671, V672, V673, V674, V675, V676, V677, V678, V679, V680, V681, V682, V683, V684, V685, V686, V687, V688, V689, V690, V691, V692, V693, V694, V695, V696, V697, V698, V699, V700, V701, V702, V703, V704, V705, V706, V707, V708, V709, V710, V711, V712, V713, V714, V715, V716, V717, V718, V719, V720, V721, V722, V723, V724, V725, V726, V727, V728, V729, V730, V731, V732, V733, V734, V735, V736, V737, V738, V739, V740, V741, V742, V743, V744, V745, V746, V747, V748, V749, V750, V751, V752, V753, V754, V755, V756, V757, V758, V759, V760, V761, V762, V763, V764, V765, V766, V767, V768, V769, V770, V771, V772, V773, V774, V775, V776, V777, V778, Rainfall, Elevation, AgeCat, Geol, UTMx, UTMy, Aca_eri, Aca_heb, Aca_mel, Aca_neb, Acr_fle, Aiz_sch, Alt_pun, Ama_pra, Apt_alb, Apt_cfli, Apt_spi, Ari_ads, Ari_con, Ari_mer, Bar_rig, Ble_mit, Bos_alb, Bul_his, Cat_ale, Cen_cil, Cha_pin, Chl_vir, Cit_lan, Cle_ang, Cle_rub, Cro_pod, Cuc_afr, Dic_cap, Enn_cen, Enn_des, Ent_ari, Era_ann, Era_cyl, Era_ech, Era_mac, Era_nin, Era_por, Era_tri, Eri_lue, Fel_sma, Gei_aca, Gei_orn, Gei_pec, Gis_afr, Gre_fla, Hel_can, Her_aff, Her_mod, Hir_gaz, Ind_arg, Ind_par, Ind_alt, Ind_aur, Ind_vic, Koh_cae, Kyl_alb, Lag_dec, Leu_bai, Lim_arg, Lim_myo, Lot_pla, Lyc_een, Lyc_oxy, Mel_rep, Mic_caf, Mon_gen, Mon_umb, Oci_ame, Oro_cap, Pha_spi, Pla_car, Pog_fle, Pse_cla, Rhi_tri, Sch_kal, Sch_pap, Sen_con, Ses_tri, Set_ver, Sti_cil, Sti_hoc, Sti_obt, Sti_uni, Tal_arn, Tra_ber, Tri_cri, Tri_ter, Inclination, GrazInt, logDist, pH, Conductivity, Skeleton, Wood, Litter, Dung, Biocrust, Fine, Gravel, Stones, Blocks, Soildepth, Cl, NO2, NO3, PO4, SO4, Na, NH4, K, Mg, Ca, habitat, v1, v2, v3, v4, v5, v6, v7, v8, v9, v10, E1, E2, E3, E4, E5, E6, E7, E8, E9, E10, E11, E12, E13, E14, E15, E16, E17, E18, E19, E20, E21, E22, E23, E24, E25, E26, E27, E28, E29, E30, E31, E32, E33, E34, E35, E36, E37, Mal, Cca, Svu, Sat, Cbr, Aap, Tme, Pma, Dmj, Lco, Fco, Lmg, Pph, Sca, Seu, Jto, Cch, Pce, Pdo, Poc, Cco, Pat, Eru, Hru, Pmo, Ttr, Eho, Ccr, Sbo, Tvi, Eci, Ecl, Pbo, Ccn, Sru, Aar, Mca, Apl, Fti, Tpi, Uep, Pmt, Pvi, Atr, Pco, Tph, Aca, Apa, Ppa, Ccx, Dur, Ppy, Rre, Rig, Sco, Sto, Ect, Oor, Ggl, Mst, Fhy, Pcr, Lar, Bbu, Ani, Ppi, Pmd, Acd, Psi, Ptr, Mmi, Lcu, Cmo, Cfa, Dmi, Cct, Cpl, Hrp, Cci, Afl, Pap, Dmt, Tto, Asp, Mci, Lte, Scu, Ppx, Ooe, Nca, Pcl, Pgr, Ccl, Msa, Ach, Mni, Lmu, Tmu, alti, alti_1, phot, roch, habi, eau, pent, arbrp, arbrf, arbup, arbuf, buip, buif, herb, Aceps, Adomo, Ajure, Anene, Athfi, Betpe, Brapi, Brasy, Carfl, Carpr, Carsp, Cardi, Carefl, Carpa, Carpe, Carre, Caresp, Carsy, Carbe, Conma, Corav, Cramo, Dacgl, Desce, Desfl, Digpu, Evoeu, Eupca, Fagsy, Feshe, Fesru, Fessp, Frave, Fraex, Galap, Gerro, Glehe, Hedhe, Hersp, Hyppe, Ileaq, Junco, Lamga, Lampu, Lonpe, Luzpi, Medlu, Mensp, Merpe, Moetr, Myosc, Oxaac, Plasp, Poach, Polmu, Polvu, Potst, Prive, Pteaq, Quero, Quesp, Ranac, Ranau, Ranfi, Ranne, Ransp, Rosca, Rubfr, Rubul, Rumac, Salca, Stelho, Teusc, Tilco, Trisp, Urtdi, Verch, Verof, Viore, V3_1, V4_1, V5_1, V6_1, V7_1, V8_1, V9_1, V10_1, V11_1, V12_1, V13_1, V14_1, V15_1, V16_1, V17_1, V18_1, V19_1, V1_2, V2_2, V3_2, V4_2, V5_2, V6_2, V7_2, V8_2, V9_2, V10_2, V11_2, V12_2, V13_2, V14_2, V15_2, V16_2, V17_2, V18_2, V19_2",chevaine::enzymaticpolymorphisminleuciscuscephalus,unique,Bons candidats spatial,spatial_model_candidate,geometrie ou coordonnees directes et variables analytiques suffisantes,point,POINT,point,connaissance_domaine,FALSE,FALSE,,,,1 relation(s) KG via 'chevaine',FALSE,,,,wiki/datasets/r_package_docs/ade4/topics/chevaine.md
ade4,doubs,doubs,observation_collection,Pair of Ecological Tables,"Verneaux, J. (1973) _Cours d'eau de Franche-Comt<c3><a9> (Massif du Jura). Recherches <c3><a9>cologiques sur le r<c3><a9>seau hydrographique du Doubs. Essai de biotypologie_. Th<c3><a8>se d'<c3><a9>tat, Besan<c3><a7>on. 1-257.","dfs, alt, slo, flo, pH, har, pho, nit, amm, oxy, bdo, Cogo, Satr, Phph, Neba, Thth, Teso, Chna, Chto, Lele, Lece, Baba, Spbi, Gogo, Eslu, Pefl, Rham, Legi, Scer, Cyca, Titi, Abbr, Icme, Acce, Ruru, Blbj, Alal, Anan, x, y",,30,38,"dfs, alt, slo, flo, pH, har, pho, nit, amm, oxy, bdo, Cogo, Satr, Phph, Neba, Thth, Teso, Chna, Chto, Lele, Lece, Baba, Spbi, Gogo, Eslu, Pefl, Rham, Legi, Scer, Cyca, Titi, Abbr, Icme, Acce, Ruru, Blbj, Alal, Anan",,Yes,Yes,"x, y",Yes,"dfs, alt, slo, flo, pH, har, pho, nit, amm, oxy, bdo, Cogo, Satr, Phph, Neba, Thth, Teso, Chna, Chto, Lele, Lece, Baba, Spbi, Gogo, Eslu, Pefl, Rham, Legi, Scer, Cyca, Titi, Abbr, Icme, Acce, Ruru, Blbj, Alal, Anan",(multivarié — pas de réponse univariée),unknown,,No,,,,,,,,,,rd_reference_only,No,,,biodiversite / ecologie,ade4::bundle::doubs,doubs,No,,"dfs, alt, slo, flo, pH, har, pho, nit, amm, oxy, bdo, Cogo, Satr, Phph, Neba, Thth, Teso, Chna, Chto, Lele, Lece, Baba, Spbi, Gogo, Eslu, Pefl, Rham, Legi, Scer, Cyca, Titi, Abbr, Icme, Acce, Ruru, Blbj, Alal, Anan",doubs::pairofecologicaltables,unique,Bons candidats spatial,spatial_model_candidate,geometrie ou coordonnees directes et variables analytiques suffisantes,point,POINT,point,index_sf:join_direct,FALSE,FALSE,,,inconnu,,FALSE,,,,wiki/datasets/r_package_docs/ade4/topics/doubs.md
ade4,elec88,elec88,observation_collection,Electoral Data,Public data,"Mitterand, Chirac, Barre, Le.Pen, Lajoinie, Waechter, Juquin, Laguillier, Boussel, dep, reg, V1, V2",,94,13,"Mitterand, Chirac, Barre, Le.Pen, Lajoinie, Waechter, Juquin, Laguillier, Boussel, dep, reg, V1, V2",,Yes,No,,Yes,"Mitterand, Chirac, Barre, Le.Pen, Lajoinie, Waechter, Juquin, Laguillier, Boussel, dep, reg, V1, V2","Mitterand, Chirac, Barre, Le.Pen, Lajoinie, Waechter, Juquin, Laguillier",unknown,,No,,,,,,,,,,rd_reference_only,No,,,a qualifier manuellement,ade4::bundle::elec88,elec88,No,,"Mitterand, Chirac, Barre, Le.Pen, Lajoinie, Waechter, Juquin, Laguillier, Boussel, dep, reg, V1, V2",elec88::electoraldata,unique,Bons candidats spatial,spatial_model_candidate,geometrie ou coordonnees directes et variables analytiques suffisantes,point,POINT,point,index_sf:join_direct,FALSE,FALSE,,"Mitterand, Chirac, Barre, Le.Pen, Lajoinie, Waechter, Juquin, Laguillier",inconnu,,FALSE,,,,wiki/datasets/r_package_docs/ade4/topics/elec88.md
