package,bundle,main_object,role,description_bundle,source,variables,auxiliary_files,n,k,analytical_variables,identifier_variables,has_geometry,has_coordinates,coordinate_columns,has_multiple_x,candidate_x_variables,candidate_y_variables,target_status,formula_text,has_referenced_paper,paper_doi,paper_doi_status,paper_title,paper_use_summary,paper_model_keywords,paper_formula_or_equation,paper_variables_used,paper_related_datasets,paper_reference_evidence,paper_evidence_status,has_place_name_if_no_geometry,place_name_columns,datetime_columns,theme,analytical_group,linked_datasets,group_has_y,group_y_variables,group_x_variables,duplicate_key,duplicate_status,final_category,usage_role,classification_reason,famille_geometrie,geom_type_origine,modalite_spatiale,modalite_provenance,a_variable_T,has_formule,variable_reponse_principale,reponse_candidats,type_reponse,paper_source_kg,has_formule_modele,formule_modele,formule_contexte,formule_graphe_ignoree,formule_doc_source
gstat,jura,prediction.dat,observation_table,Jura data set,,"Xloc, Yloc, Landuse, Rock, Cd, Co, Cr, Cu, Ni, Pb, Zn",,259,9,"Landuse, Rock, Cd, Co, Cr, Cu, Ni, Pb, Zn",,Yes,Yes,"Xloc, Yloc",Yes,"Landuse, Rock","Cd, Co, Cr, Cu, Ni, Pb, Zn",strong_name,,Yes,,unknown_not_found,"Geostatistics for Natural Resources Evaluation. Oxford Univ. Press, New-York, 483 p. Appendix C describes (and gives) the Jura data set. Atteia, O., Dubois, J.-P., Webster, R., ...","Referenced work: Geostatistics for Natural Resources Evaluation. Oxford Univ. Press, New-York, 483 p. Appendix C describes (and gives) the Jura data set. Atteia, O., Dubois, J.-P., Webster, R., ....",,,,,"Goovaerts, P. 1997. Geostatistics for Natural Resources Evaluation. Oxford Univ. Press, New-York, 483 p. Appendix C describes (and gives) the Jura data set. Atteia, O., Dubois, J.-P., Webster, R., 1994, Geostatistical analysis of soil contamination in the Swiss Jura: Environmental Pollution 86, 315-327 Webster, R., Atteia, O., Dubois, J.-P., 1994, Coregionalization of trace metals in the soil in the Swiss Jura: European Journal of Soil Science 45, 205-218",rd_reference_only,No,,,a qualifier manuellement,gstat::paper::unknown_not_found,"tull, coalash, jura, meuse.all, oxford, pcb, wind",Yes,"Cd, Co, Cr, Cu, Ni, Pb, Zn, cadmium, copper, lead, zinc","S411, S429, S849, S854, S1502, S1584, S1591, S2046, S2047, S2048, S2049, S2051, S2052, S2053, S2054, S2055, S2057, S2058, S2059, S2060, S2061, S2062, S2063, S2064, S2065, S2066, S2067, S2070, S2071, S2072, S2128, S5319, S5320, S5322, S5323, coalash, Landuse, Rock, X, Rock.type, Block.Ni, sample, elev, dist.m, om, ffreq, soil, lime, landuse, in.pit, in.meuse155, in.BMcD, PROFILE, ELEV, PROFCLASS, MAPCLASS, VAL1, CHR1, LIME1, VAL2, CHR2, LIME2, DEPTHCM, DEP2LIME, PCLAY1, PCLAY2, MG1, OM1, CEC1, PH1, PHOS1, POT1, coast, depth, PCB138, yf, RPT, VAL, ROS, KIL, SHA, BIR, DUB, CLA, MUL, CLO, BEL, MAL, MeanWind",predictiondat::juradataset,unique,Bons candidats spatial,spatial_model_candidate,geometrie ou coordonnees directes et variables analytiques suffisantes,point,POINT,point,index_sf:join_direct,FALSE,FALSE,Cd,,continu,1 relation(s) KG via 'jura',FALSE,,,,wiki/datasets/r_package_docs/gstat/topics/jura.md
gstat,jura,validation.dat,observation_table,Jura data set,,"Xloc, Yloc, Landuse, Rock, Cd, Co, Cr, Cu, Ni, Pb, Zn",,100,9,"Landuse, Rock, Cd, Co, Cr, Cu, Ni, Pb, Zn",,Yes,Yes,"Xloc, Yloc",Yes,"Landuse, Rock","Cd, Co, Cr, Cu, Ni, Pb, Zn",strong_name,,Yes,,unknown_not_found,"Geostatistics for Natural Resources Evaluation. Oxford Univ. Press, New-York, 483 p. Appendix C describes (and gives) the Jura data set. Atteia, O., Dubois, J.-P., Webster, R., ...","Referenced work: Geostatistics for Natural Resources Evaluation. Oxford Univ. Press, New-York, 483 p. Appendix C describes (and gives) the Jura data set. Atteia, O., Dubois, J.-P., Webster, R., ....",,,,,"Goovaerts, P. 1997. Geostatistics for Natural Resources Evaluation. Oxford Univ. Press, New-York, 483 p. Appendix C describes (and gives) the Jura data set. Atteia, O., Dubois, J.-P., Webster, R., 1994, Geostatistical analysis of soil contamination in the Swiss Jura: Environmental Pollution 86, 315-327 Webster, R., Atteia, O., Dubois, J.-P., 1994, Coregionalization of trace metals in the soil in the Swiss Jura: European Journal of Soil Science 45, 205-218",rd_reference_only,No,,,a qualifier manuellement,gstat::paper::unknown_not_found,"tull, coalash, jura, meuse.all, oxford, pcb, wind",Yes,"Cd, Co, Cr, Cu, Ni, Pb, Zn, cadmium, copper, lead, zinc","S411, S429, S849, S854, S1502, S1584, S1591, S2046, S2047, S2048, S2049, S2051, S2052, S2053, S2054, S2055, S2057, S2058, S2059, S2060, S2061, S2062, S2063, S2064, S2065, S2066, S2067, S2070, S2071, S2072, S2128, S5319, S5320, S5322, S5323, coalash, Landuse, Rock, X, Rock.type, Block.Ni, sample, elev, dist.m, om, ffreq, soil, lime, landuse, in.pit, in.meuse155, in.BMcD, PROFILE, ELEV, PROFCLASS, MAPCLASS, VAL1, CHR1, LIME1, VAL2, CHR2, LIME2, DEPTHCM, DEP2LIME, PCLAY1, PCLAY2, MG1, OM1, CEC1, PH1, PHOS1, POT1, coast, depth, PCB138, yf, RPT, VAL, ROS, KIL, SHA, BIR, DUB, CLA, MUL, CLO, BEL, MAL, MeanWind",validationdat::juradataset,unique,Bons candidats spatial,spatial_model_candidate,geometrie ou coordonnees directes et variables analytiques suffisantes,point,POINT,point,index_sf:join_direct,FALSE,FALSE,Cd,,continu,1 relation(s) KG via 'jura',FALSE,,,,wiki/datasets/r_package_docs/gstat/topics/jura.md
gstat,meuse.all,meuse.all,predictor_table,"Meuse river data set - original, full data set",,"sample, x, y, cadmium, copper, lead, zinc, elev, dist.m, om, ffreq, soil, lime, landuse, in.pit, in.meuse155, in.BMcD",,164,15,"sample, cadmium, copper, lead, zinc, elev, dist.m, om, ffreq, soil, lime, landuse, in.pit, in.meuse155, in.BMcD",,Yes,Yes,"x, y",Yes,"sample, elev, dist.m, om, ffreq, soil, lime, landuse, in.pit, in.meuse155, in.BMcD","cadmium, copper, lead, zinc",strong_name,,Yes,,unknown_not_found,Principles of Geographical Information Systems. Oxford University Press.,Referenced work: Principles of Geographical Information Systems. Oxford University Press..,,,,,"P.A. Burrough, R.A. McDonnell, 1998. Principles of Geographical Information Systems. Oxford University Press.",rd_reference_only,No,,,environnement / climat,gstat::paper::unknown_not_found,"tull, coalash, jura, meuse.all, oxford, pcb, wind",Yes,"Cd, Co, Cr, Cu, Ni, Pb, Zn, cadmium, copper, lead, zinc","S411, S429, S849, S854, S1502, S1584, S1591, S2046, S2047, S2048, S2049, S2051, S2052, S2053, S2054, S2055, S2057, S2058, S2059, S2060, S2061, S2062, S2063, S2064, S2065, S2066, S2067, S2070, S2071, S2072, S2128, S5319, S5320, S5322, S5323, coalash, Landuse, Rock, X, Rock.type, Block.Ni, sample, elev, dist.m, om, ffreq, soil, lime, landuse, in.pit, in.meuse155, in.BMcD, PROFILE, ELEV, PROFCLASS, MAPCLASS, VAL1, CHR1, LIME1, VAL2, CHR2, LIME2, DEPTHCM, DEP2LIME, PCLAY1, PCLAY2, MG1, OM1, CEC1, PH1, PHOS1, POT1, coast, depth, PCB138, yf, RPT, VAL, ROS, KIL, SHA, BIR, DUB, CLA, MUL, CLO, BEL, MAL, MeanWind",meuseall::meuseriverdatasetoriginalfulldataset,unique,Bons candidats spatial,spatial_model_candidate,geometrie ou coordonnees directes et variables analytiques suffisantes,point,POINT,point,index_sf:join_direct,FALSE,FALSE,cadmium,,continu,2 relation(s) KG via 'meuse.all',FALSE,,,,wiki/datasets/r_package_docs/gstat/topics/meuse.all.md
gstat,oxford,oxford,predictor_table,Oxford soil samples,,"PROFILE, XCOORD, YCOORD, ELEV, PROFCLASS, MAPCLASS, VAL1, CHR1, LIME1, VAL2, CHR2, LIME2, DEPTHCM, DEP2LIME, PCLAY1, PCLAY2, MG1, OM1, CEC1, PH1, PHOS1, POT1",,126,20,"PROFILE, ELEV, PROFCLASS, MAPCLASS, VAL1, CHR1, LIME1, VAL2, CHR2, LIME2, DEPTHCM, DEP2LIME, PCLAY1, PCLAY2, MG1, OM1, CEC1, PH1, PHOS1, POT1",,Yes,Yes,"XCOORD, YCOORD",Yes,"PROFILE, ELEV, PROFCLASS, MAPCLASS, VAL1, CHR1, LIME1, VAL2, CHR2, LIME2, DEPTHCM, DEP2LIME, PCLAY1, PCLAY2, MG1, OM1, CEC1, PH1, PHOS1, POT1",VAL1,unknown,,Yes,,unknown_not_found,"Principles of Geographical Information Systems. Oxford University Press. | Data: 126 soil augerings on a 100 x 100m square grid, with 6 columns and 21 rows. Grid is oriented wit...","Referenced work: Principles of Geographical Information Systems. Oxford University Press. | Data: 126 soil augerings on a 100 x 100m square grid, with 6 columns and 21 rows. Grid is oriented wit....",,,,,"P.A. Burrough, R.A. McDonnell, 1998. Principles of Geographical Information Systems. Oxford University Press. | Data: 126 soil augerings on a 100 x 100m square grid, with 6 columns and 21 rows. Grid is oriented with long axis North-north-west to South-south-east Origin of grid is South-south-east point, 100m outside grid. Original data are part of a soil survey carried out by P.A. Burrough in 1967. The survey area is located on the chalk downlands on the Berkshire Downs in Oxfordshire, UK. Three soil profile units were recognised on the shallow Rendzina soils; these are Ia - very shallow, grey calcareous soils less than 40cm deep over chalk; Ct - shallow to moderately deep, grey-brown calcareous soils on calcareous colluvium, and Cr: deep, moderately acid, red-brown clayey soils. These soil profile classes were registered at every augering. In addition, an independent landscape soil map was made by interpolating soil boundaries between these soil types, using information from the changes in landform. Because the soil varies over short distances, this field mapping caused some soil borings to receive a different classification from the classification based on the point data. Also registered at each auger point were the site elevation (m), the depth to solid chalk rock (in cm) and the depth to lime in cm. Also, the percent clay content, the Munsell colour components of VALUE and CHROMA , and the lime content of the soil (as tested using HCl) were recorded for the top two soil layers (0-20cm and 20-40cm). Samples of topsoil taken as a bulk sample within a circle of radius 2.5m around each sample point were used for the laboratory determination of Mg (ppm), OM1 %, CEC as mequ/100g air dry soil, pH, P as ppm and K (ppm).",rd_reference_only,No,,,environnement / climat,gstat::paper::unknown_not_found,"tull, coalash, jura, meuse.all, oxford, pcb, wind",Yes,"Cd, Co, Cr, Cu, Ni, Pb, Zn, cadmium, copper, lead, zinc","S411, S429, S849, S854, S1502, S1584, S1591, S2046, S2047, S2048, S2049, S2051, S2052, S2053, S2054, S2055, S2057, S2058, S2059, S2060, S2061, S2062, S2063, S2064, S2065, S2066, S2067, S2070, S2071, S2072, S2128, S5319, S5320, S5322, S5323, coalash, Landuse, Rock, X, Rock.type, Block.Ni, sample, elev, dist.m, om, ffreq, soil, lime, landuse, in.pit, in.meuse155, in.BMcD, PROFILE, ELEV, PROFCLASS, MAPCLASS, VAL1, CHR1, LIME1, VAL2, CHR2, LIME2, DEPTHCM, DEP2LIME, PCLAY1, PCLAY2, MG1, OM1, CEC1, PH1, PHOS1, POT1, coast, depth, PCB138, yf, RPT, VAL, ROS, KIL, SHA, BIR, DUB, CLA, MUL, CLO, BEL, MAL, MeanWind",oxford::oxfordsoilsamples,unique,Bons candidats spatial,spatial_model_candidate,geometrie ou coordonnees directes et variables analytiques suffisantes,point,POINT,point,index_sf:join_direct,FALSE,FALSE,VAL1,,discret,1 relation(s) KG via 'oxford',FALSE,,,,wiki/datasets/r_package_docs/gstat/topics/oxford.md
sp,meuse,meuse,predictor_table,Meuse river data set,,"x, y, cadmium, copper, lead, zinc, elev, dist, om, ffreq, soil, lime, landuse, dist.m",,155,12,"cadmium, copper, lead, zinc, elev, dist, om, ffreq, soil, lime, landuse, dist.m",,Yes,Yes,"x, y",Yes,"elev, dist, om, ffreq, soil, lime, landuse, dist.m","cadmium, copper, lead, zinc",strong_name,,Yes,,unknown_not_found,"Soil pollution with heavy metals - an inquiry into spatial variation, cost of mapping and the risk evaluation of copper, cadmium, lead and zinc in the floodplains of the Meuse w...","Referenced work: Soil pollution with heavy metals - an inquiry into spatial variation, cost of mapping and the risk evaluation of copper, cadmium, lead and zinc in the floodplains of the Meuse w.... The title indicates a modeling or prediction use; the exact equation was not recovered locally.",,,,,"M G J Rikken and R P G Van Rijn, 1993. Soil pollution with heavy metals - an inquiry into spatial variation, cost of mapping and the risk evaluation of copper, cadmium, lead and zinc in the floodplains of the Meuse west of Stein, the Netherlands. Doctoraalveldwerkverslag, Dept. of Physical Geography, Utrecht University P.A. Burrough, R.A. McDonnell, 1998. Principles of Geographical Information Systems. Oxford University Press. Stichting voor Bodemkartering (STIBOKA), 1970. Bodemkaart van Nederland : Blad 59 Peer, Blad 60 West en 60 Oost Sittard: schaal 1 : 50 000. Wageningen, STIBOKA.",rd_reference_only,No,,,environnement / climat,sp::paper::unknown_not_found,"GridsDatums, meuse",Yes,"cadmium, copper, lead, zinc","elev, dist, om, ffreq, soil, lime, landuse, dist.m",meuse::meuseriverdataset,unique,Bons candidats spatial,spatial_model_candidate,geometrie ou coordonnees directes et variables analytiques suffisantes,point,POINT,point,index_sf:join_direct,FALSE,FALSE,cadmium,,continu,4 relation(s) KG via 'meuse',FALSE,,,,wiki/datasets/r_package_docs/sp/topics/meuse.md
sp,meuse.grid,meuse.grid,observation_table,Prediction Grid for Meuse Data Set,,"x, y, part.a, part.b, dist, soil, ffreq",,3103,5,"part.a, part.b, dist, soil, ffreq",,Yes,Yes,"x, y",Yes,"part.a, part.b, dist, soil, ffreq","part.a, part.b, dist, soil, ffreq",unknown,,No,10.1007/s13253-023-00571-0,,Spatial Statistics for Data Science doi:10.1007/s13253-023-00571-0,,,,,,KG:paper:doi:10.1007/s13253-023-00571-0,rd_reference_only,No,,,environnement / climat,sp::bundle::meuse.grid,meuse.grid,No,,"part.a, part.b, dist, soil, ffreq",meusegrid::predictiongridformeusedataset,unique,Bons candidats spatial,spatial_model_candidate,geometrie ou coordonnees directes et variables analytiques suffisantes,point,POINT,grille,index_sf:join_direct,FALSE,FALSE,,"part.a, part.b, dist, soil, ffreq",inconnu,1 relation(s) KG via 'meuse.grid',FALSE,,,,wiki/datasets/r_package_docs/sp/topics/meuse.grid.md
sp,meuse.grid_ll,meuse.grid_ll,spatial_observations,"Prediction Grid for Meuse Data Set, geographical coordinates",See the meuse documentation,"part.a, part.b, dist, soil, ffreq",,3103,5,"part.a, part.b, dist, soil, ffreq",,Yes,No,,Yes,"part.a, part.b, dist, soil, ffreq","part.a, part.b, dist, soil, ffreq",unknown,,No,,,,,,,,,,rd_reference_only,No,,,environnement / climat,sp::bundle::meuse.grid_ll,meuse.grid_ll,No,,"part.a, part.b, dist, soil, ffreq",meusegridll::predictiongridformeusedatasetgeographicalcoordinates,unique,Bons candidats spatial,spatial_model_candidate,geometrie ou coordonnees directes et variables analytiques suffisantes,point,POINT,grille,index_sf:join_direct,FALSE,FALSE,,"part.a, part.b, dist, soil, ffreq",inconnu,,FALSE,,,,wiki/datasets/r_package_docs/sp/topics/meuse.grid_ll.md
sfdep,guerry,guerry,spatial_observations,"""Essay on the Moral Statistics of France"" data set.",'Guerry::gfrance85',"code_dept, count, ave_id_geo, dept, region, department, crime_pers, crime_prop, literacy, donations, infants, suicides, main_city, wealth, commerce, clergy, crime_parents, infanticide, donation_clergy, lottery, desertion, instruction, prostitutes, distance, area, pop1831, geometry",,85,21,"count, dept, crime_pers, crime_prop, literacy, donations, infants, suicides, wealth, commerce, clergy, crime_parents, infanticide, donation_clergy, lottery, desertion, instruction, prostitutes, distance, area, pop1831",code_dept,Yes,No,,Yes,"dept, literacy, donations, infants, wealth, commerce, clergy, infanticide, donation_clergy, lottery, desertion, instruction, prostitutes, distance, area","count, crime_pers, crime_prop, suicides, crime_parents, pop1831",strong_name,,No,10.1214/10-aoas356,,"A Revisit Of Guerry's Data: Introducing Spatial Constraints In Multivariate Analysis. _The Annals of Applied Statistics_, Vol. 5, No. 4, 2278-2299. <https://arxiv.org/pdf/120... doi:10.1214/10-AOAS356",,,,,,KG:paper:doi:10.1214/10-aoas356,rd_reference_only,No,"ave_id_geo, region, department, main_city",,crime / conflit / securite,sfdep::bundle::guerry,guerry,Yes,"count, crime_pers, crime_prop, suicides, crime_parents, pop1831","dept, literacy, donations, infants, wealth, commerce, clergy, infanticide, donation_clergy, lottery, desertion, instruction, prostitutes, distance, area",guerry::essayonthemoralstatisticsoffrancedataset,unique,Bons candidats spatial,spatial_model_candidate,geometrie ou coordonnees directes et variables analytiques suffisantes,polygone,MULTIPOLYGON,polygone,index_sf:variante_inter_langue,FALSE,FALSE,Pop1831,,continu,1 relation(s) KG via 'guerry',FALSE,,,,wiki/datasets/r_package_docs/sfdep/topics/guerry.md
sfdep,guerry_nb,guerry_nb,spatial_observations,"""Essay on the Moral Statistics of France"" data set.",'Guerry::gfrance85',"code_dept, count, ave_id_geo, dept, region, department, crime_pers, crime_prop, literacy, donations, infants, suicides, main_city, wealth, commerce, clergy, crime_parents, infanticide, donation_clergy, lottery, desertion, instruction, prostitutes, distance, area, pop1831, geometry, nb, wt",,85,21,"count, dept, crime_pers, crime_prop, literacy, donations, infants, suicides, wealth, commerce, clergy, crime_parents, infanticide, donation_clergy, lottery, desertion, instruction, prostitutes, distance, area, pop1831",code_dept,Yes,No,,Yes,"dept, literacy, donations, infants, wealth, commerce, clergy, infanticide, donation_clergy, lottery, desertion, instruction, prostitutes, distance, area","count, crime_pers, crime_prop, suicides, crime_parents, pop1831",strong_name,,No,,,,,,,,,,rd_reference_only,No,"ave_id_geo, region, department, main_city",,crime / conflit / securite,sfdep::bundle::guerry_nb,guerry_nb,Yes,"count, crime_pers, crime_prop, suicides, crime_parents, pop1831","dept, literacy, donations, infants, wealth, commerce, clergy, infanticide, donation_clergy, lottery, desertion, instruction, prostitutes, distance, area",guerrynb::essayonthemoralstatisticsoffrancedataset,unique,Bons candidats spatial,spatial_model_candidate,geometrie ou coordonnees directes et variables analytiques suffisantes,polygone,MULTIPOLYGON,polygone,index_sf:join_direct,FALSE,FALSE,count,,discret,,doc_absente,,,,
surveillance,hagelloch,hagelloch,response_table,"1861 Measles Epidemic in the City of Hagelloch, Germany","Thanks to Peter J. Neal, University of Manchester, for providing us with these data, which he again became from Niels Becker, Australian National University. To cite the data, the main references are Pfeilsticker (1863) and Oesterle (1992).","BLOCK, id, start, stop, atRiskY, event, Revent, x.loc, y.loc, SEX, AGE, CL, household, nothousehold, c1, c2",,70500,13,"BLOCK, start, stop, atRiskY, event, Revent, SEX, AGE, CL, household, nothousehold, c1, c2",id,Yes,Yes,"x.loc, y.loc",Yes,"BLOCK, start, stop, atRiskY, event, Revent, SEX, AGE, CL, household, nothousehold, c1, c2","BLOCK, start, stop, atRiskY, event, Revent, SEX, AGE",unknown,,No,10.18637/jss.v077.i11,,Spatio-Temporal Analysis of Epidemic Phenomena Using the R Package surveillance doi:10.18637/jss.v077.i11,,,,,,KG:paper:doi:10.18637/jss.v077.i11,rd_reference_only,No,,,housing / immobilier,surveillance::bundle::hagelloch,hagelloch,No,,"BLOCK, start, stop, atRiskY, event, Revent, SEX, AGE, CL, household, nothousehold, c1, c2, PN, FN, HN, IFTO, SI, C, PR, CA, NI, GE, TD, TM, tPRO, tERU, tDEAD, tR, tI",hagelloch::1861measlesepidemicinthecityofhagellochgermany,unique,Bons candidats spatial,spatial_model_candidate,geometrie ou coordonnees directes et variables analytiques suffisantes,point,POINT,point,index_sf:join_direct,FALSE,FALSE,,"BLOCK, start, stop, atRiskY, event, Revent, SEX, AGE",inconnu,1 relation(s) KG via 'hagelloch',FALSE,,,,wiki/datasets/r_package_docs/surveillance/topics/hagelloch.md
surveillance,hagelloch,hagelloch.df,response_table,"1861 Measles Epidemic in the City of Hagelloch, Germany","Thanks to Peter J. Neal, University of Manchester, for providing us with these data, which he again became from Niels Becker, Australian National University. To cite the data, the main references are Pfeilsticker (1863) and Oesterle (1992).","PN, NAME, FN, HN, AGE, SEX, PRO, ERU, CL, DEAD, IFTO, SI, C, PR, CA, NI, GE, TD, TM, x.loc, y.loc, tPRO, tERU, tDEAD, tR, tI",,188,20,"PN, FN, HN, AGE, SEX, CL, IFTO, SI, C, PR, CA, NI, GE, TD, TM, tPRO, tERU, tDEAD, tR, tI",NAME,Yes,Yes,"x.loc, y.loc",Yes,"PN, FN, HN, AGE, SEX, CL, IFTO, SI, C, PR, CA, NI, GE, TD, TM, tPRO, tERU, tDEAD, tR, tI","PN, FN, HN, AGE, SEX, CL, IFTO, SI",unknown,,No,10.18637/jss.v077.i11,,Spatio-Temporal Analysis of Epidemic Phenomena Using the R Package surveillance doi:10.18637/jss.v077.i11,,,,,,KG:paper:doi:10.18637/jss.v077.i11,rd_reference_only,No,NAME,"PRO, ERU, DEAD",sante / epidemiologie,surveillance::bundle::hagelloch,hagelloch,No,,"BLOCK, start, stop, atRiskY, event, Revent, SEX, AGE, CL, household, nothousehold, c1, c2, PN, FN, HN, IFTO, SI, C, PR, CA, NI, GE, TD, TM, tPRO, tERU, tDEAD, tR, tI",hagellochdf::1861measlesepidemicinthecityofhagellochgermany,unique,Bons candidats spatial,spatial_model_candidate,geometrie ou coordonnees directes et variables analytiques suffisantes,point,POINT,point,index_sf:join_direct,TRUE,FALSE,,"PN, FN, HN, AGE, SEX, CL, IFTO, SI",inconnu,1 relation(s) KG via 'hagelloch',FALSE,,,,wiki/datasets/r_package_docs/surveillance/topics/hagelloch.md
