priority_score,paper_title,paper_year,paper_doi,paper_venue,candidate_decision,literature_score,task_type,detected_methods,mentioned_datasets,useful_dataset_link_count,first_useful_dataset_link,description_excerpt
11,SoilGrids250m: Global gridded soil information based on machine learning,2017,10.1371/journal.pone.0169748,PLoS ONE,review,9,forecasting,random_forest; gradient_boosting; machine_learning; cross_validation; logistic_regression,SoilGrids250m; SoilGrids,12,https://journals.plos.org/plosone/article/file?id=10.1371/journal.pone.0169748&type=printable,"This paper describes the technical development and accuracy assessment of the most recent and improved version of the SoilGrids system at 250m resolution (June 2016 update). SoilGrids provides global predictions for standard numeric soil properties (organic carbon, bulk density, Cation Exchange Capacity (CEC), pH, soil texture fractions and coarse fragments) at seven standard depths (0, 5, 15, 30, 60, 100 and 200 cm), in addition to predictions of depth to bedrock and distribution of soil classes based on the World Reference Base (WRB) and USDA classification systems (ca. 280 raster layers in total). Predictions were based on ca. 150,000 soil profiles used for training and a stack of 158 remote sensing-based soil covariates (primarily derived from MODIS land products, SRTM DEM derivatives, climatic images and global landform and lithology maps), which were used to fit an ensemble of machine learning methods-random forest and gradient boosting and/or multinomial logistic regression-as..."
10,SoilGrids 2.0: producing soil information for the globe with quantified spatial uncertainty,2021,10.5194/soil-7-217-2021,SOIL,review,5,forecasting,machine_learning; cross_validation; uncertainty_quantification; hyperparameter_selection,SoilGrids 2.0; SoilGrids,200,https://soil.copernicus.org/articles/7/217/2021/soil-7-217-2021.pdf,"Abstract. SoilGrids produces maps of soil properties for the entire globe at medium spatial resolution (250 m cell size) using state-of-the-art machine learning methods to generate the necessary models. It takes as inputs soil observations from about 240 000 locations worldwide and over 400 global environmental covariates describing vegetation, terrain morphology, climate, geology and hydrology. The aim of this work was the production of global maps of soil properties, with cross-validation, hyper-parameter selection and quantification of spatially explicit uncertainty, as implemented in the SoilGrids version 2.0 product incorporating state-of-the-art practices and adapting them for global digital soil mapping with legacy data. The paper presents the evaluation of the global predictions produced for soil organic carbon content, total nitrogen, coarse fragments, pH (water), cation exchange capacity, bulk density and texture fractions at six standard depths (up to 200 cm). The..."
10,"The CHRS Data Portal, an easily accessible public repository for PERSIANN global satellite precipitation data",2019,10.1038/sdata.2018.296,Scientific Data,review,5,machine_learning,artificial_neural_network,PERSIANN; PERSIANN-Cloud Classification System; PERSIANN-Climate Data Record; CHRS Data Portal,11,https://www.nature.com/articles/sdata2018296.pdf,"The Center for Hydrometeorology and Remote Sensing (CHRS) has created the CHRS Data Portal to facilitate easy access to the three open data licensed satellite-based precipitation datasets generated by our Precipitation Estimation from Remotely Sensed Information using Artificial Neural Networks (PERSIANN) system: PERSIANN, PERSIANN-Cloud Classification System (CCS), and PERSIANN-Climate Data Record (CDR). These datasets have the potential for widespread use by various researchers, professionals including engineers, city planners, and so forth, as well as the community at large. Researchers at CHRS created the CHRS Data Portal with an emphasis on simplicity and the intention of fostering synergistic relationships with scientists and experts from around the world. The following paper presents an outline of the hosted datasets and features available on the CHRS Data Portal, an examination of the necessity of easily accessible public data, a comprehensive overview of the PERSIANN..."
7,The Global Methane Budget 2000-2017,2019,10.5194/essd-12-1561-2020,NOAA Institutional Repository,keep,8,machine_learning,,Global Methane Budget,15,https://www.mendeley.com/import/?url=https%3A%2F%2Fessd.copernicus.org%2Farticles%2F12%2F1561%2F2020%2F,"Understanding and quantifying the global methane (CH4) budget is important for assessing realistic pathways to mitigate climate change. Atmospheric emissions and concentrations of CH4 continue to increase, making CH4 the second most important human-influenced greenhouse gas in terms of climate forcing, after carbon dioxide (CO2). The relative importance of CH4 compared to CO2 depends on its shorter atmospheric\nlifetime, stronger warming potential, and variations in atmospheric growth rate over the past decade, the causes of which are still debated. Two major challenges in reducing uncertainties in the atmospheric growth rate arise from the variety of geographically overlapping CH4 sources and from the destruction of CH4 by short-lived hydroxyl radicals (OH). To address these challenges, we have established a consortium of multidisciplinary scientists under the umbrella of the Global Carbon Project to synthesize and stimulate new research aimed at improving and regularly updating the..."
7,Convolutional neural networks: an overview and application in radiology,2018,10.1007/s13244-018-0639-9,Insights into Imaging,review,5,machine_learning,machine_learning; convolutional_neural_network; artificial_neural_network,,7,https://doaj.org/article/dc12a8d883e9458db742fd7c1c320370,"Convolutional neural network (CNN), a class of artificial neural networks that has become dominant in various computer vision tasks, is attracting interest across a variety of domains, including radiology. CNN is designed to automatically and adaptively learn spatial hierarchies of features through backpropagation by using multiple building blocks, such as convolution layers, pooling layers, and fully connected layers. This review article offers a perspective on the basic concepts of CNN and its application to various radiological tasks, and discusses its challenges and future directions in the field of radiology. Two challenges in applying CNN to radiological tasks, small dataset and overfitting, will also be covered in this article, as well as techniques to minimize them. Being familiar with the concepts and advantages, as well as limitations, of CNN is essential to leverage its potential in diagnostic radiology, with the goal of augmenting the performance of radiologists and..."
7,The world’s user-generated road map is more than 80% complete,2017,10.1371/journal.pone.0180698,PLoS ONE,review,5,regression,multilevel_regression_poststratification; sigmoid_curve,OpenStreetMap,12,https://journals.plos.org/plosone/article/file?id=10.1371/journal.pone.0180698&type=printable,"OpenStreetMap, a crowdsourced geographic database, provides the only global-level, openly licensed source of geospatial road data, and the only national-level source in many countries. However, researchers, policy makers, and citizens who want to make use of OpenStreetMap (OSM) have little information about whether it can be relied upon in a particular geographic setting. In this paper, we use two complementary, independent methods to assess the completeness of OSM road data in each country in the world. First, we undertake a visual assessment of OSM data against satellite imagery, which provides the input for estimates based on a multilevel regression and poststratification model. Second, we fit sigmoid curves to the cumulative length of contributions, and use them to estimate the saturation level for each country. Both techniques may have more general use for assessing the development and saturation of crowd-sourced data. Our results show that in many places, researchers and..."
5,TGVx: Dynamic Personalized POI Deep Recommendation Model,2023,10.1287/ijoc.2023.1286,INFORMS journal on computing,keep,9,machine_learning,machine_learning,,1,https://github.com/INFORMSJoC/2021.0010,"Personalized points-of-interest (POI) recommendation is very important for improving the service quality of location-based social network applications. It has become one of the most popular research directions in the industry and academia. However, the realization of high-quality personalized POI recommendation faces three major challenges: (i) the interest drift issue caused by the spatiotemporal dynamics of user check-in behavior, (ii) how to integrate as much heterogeneous information as possible to alleviate data sparseness and cold start issues, and (iii) how to use implicit feedback to model complex high-order nonlinear user-POI interactions. To jointly address all these challenges, we propose the TGVx recommendation framework and establish a dynamic personalized POI deep recommendation model, where T and G respectively represent time and geographic factors, V represents out-of-town visitors, and x represents time slot number. TGVx is composed of x parallel TGV models where the..."
5,Compositional shifts in root-associated bacterial and archaeal microbiota track the plant life cycle in field-grown rice,2018,10.1371/journal.pbio.2003862,PLoS Biology,review,7,forecasting,random_forest,,12,https://figshare.com/articles/dataset/Compositional_shifts_in_root-associated_bacterial_and_archaeal_microbiota_track_the_plant_life_cycle_in_field-grown_rice/5919577,"Bacterial communities associated with roots impact the health and nutrition of the host plant. The dynamics of these microbial assemblies over the plant life cycle are, however, not well understood. Here, we use dense temporal sampling of 1,510 samples from root spatial compartments to characterize the bacterial and archaeal components of the root-associated microbiota of field grown rice (Oryza sativa) over the course of 3 consecutive growing seasons, as well as 2 sites in diverse geographic regions. The root microbiota was found to be highly dynamic during the vegetative phase of plant growth and then stabilized compositionally for the remainder of the life cycle. Bacterial and archaeal taxa conserved between field sites were defined as predictive features of rice plant age by modeling using a random forest approach. The age-prediction models revealed that drought-stressed plants have developmentally immature microbiota compared to unstressed plants. Further, by using genotypes with..."
5,Perspectives in machine learning for wildlife conservation,2022,10.1038/s41467-022-27980-y,Nature Communications,review,5,machine_learning,machine_learning,,11,https://www.nature.com/articles/s41467-022-27980-y.pdf,"Inexpensive and accessible sensors are accelerating data acquisition in animal ecology. These technologies hold great potential for large-scale ecological understanding, but are limited by current processing approaches which inefficiently distill data into relevant information. We argue that animal ecologists can capitalize on large datasets generated by modern sensors by combining machine learning approaches with domain knowledge. Incorporating machine learning into ecological workflows could improve inputs for ecological models and lead to integrated hybrid modeling tools. This approach will require close interdisciplinary collaboration to ensure the quality of novel approaches and train a new generation of data scientists in ecology and conservation."
5,"Applications of Machine Learning in Human Microbiome Studies: A Review on Feature Selection, Biomarker Identification, Disease Prediction and Treatment",2021,10.3389/fmicb.2021.634511,Frontiers in Microbiology,drop_or_low_priority,5,forecasting,machine_learning,,5,https://doaj.org/article/4909973f38ce4c5a93f87a36eb2dfaa5,"The number of microbiome-related studies has notably increased the availability of data on human microbiome composition and function. These studies provide the essential material to deeply explore host-microbiome associations and their relation to the development and progression of various complex diseases. Improved data-analytical tools are needed to exploit all information from these biological datasets, taking into account the peculiarities of microbiome data, i.e., compositional, heterogeneous and sparse nature of these datasets. The possibility of predicting host-phenotypes based on taxonomy-informed feature selection to establish an association between microbiome and predict disease states is beneficial for personalized medicine. In this regard, machine learning (ML) provides new insights into the development of models that can be used to predict outputs, such as classification and prediction in microbiology, infer host phenotypes to predict diseases and use microbial..."
5,Prediction of Diabetes Empowered With Fused Machine Learning,2022,10.1109/access.2022.3142097,IEEE Access,drop_or_low_priority,5,forecasting,machine_learning; support_vector_machine; artificial_neural_network; fuzzy_logic,,1,https://doaj.org/article/b1fa167269e54f3ba4ced24b152e26c4,"In the medical field, it is essential to predict diseases early to prevent them. Diabetes is one of the most dangerous diseases all over the world. In modern lifestyles, sugar and fat are typically present in our dietary habits, which have increased the risk of diabetes. To predict the disease, it is extremely important to understand its symptoms. Currently, machine-learning (ML) algorithms are valuable for disease detection. This article presents a model using a fused machine learning approach for diabetes prediction. The conceptual framework consists of two types of models: Support Vector Machine (SVM) and Artificial Neural Network (ANN) models. These models analyze the dataset to determine whether a diabetes diagnosis is positive or negative. The dataset used in this research is divided into training data and testing data with a ratio of 70:30 respectively. The output of these models becomes the input membership function for the fuzzy model, whereas the fuzzy logic finally..."
5,Deep Convolutional and LSTM Recurrent Neural Networks for Multimodal Wearable Activity Recognition,2016,10.3390/s16010115,Sensors,review,5,machine_learning,convolutional_neural_network; lstm_rnn; hyperparameter_selection,,2,https://figshare.com/articles/journal_contribution/Deep_convolutional_and_LSTM_recurrent_neural_networks_for_multimodal_wearable_activity_recognition/23426657,"Human activity recognition (HAR) tasks have traditionally been solved using engineered features obtained by heuristic processes. Current research suggests that deep convolutional neural networks are suited to automate feature extraction from raw sensor inputs. However, human activities are made of complex sequences of motor movements, and capturing this temporal dynamics is fundamental for successful HAR. Based on the recent success of recurrent neural networks for time series domains, we propose a generic deep framework for activity recognition based on convolutional and LSTM recurrent units, which: (i) is suitable for multimodal wearable sensors; (ii) can perform sensor fusion naturally; (iii) does not require expert knowledge in designing features; and (iv) explicitly models the temporal dynamics of feature activations. We evaluate our framework on two datasets, one of which has been used in a public activity recognition challenge. Our results show that our framework outperforms..."
5,"Performance Analysis of IoT-Based Sensor, Big Data Processing, and Machine Learning Model for Real-Time Monitoring System in Automotive Manufacturing",2018,10.3390/s18092946,Sensors,review,5,forecasting,random_forest; machine_learning; dbscan; apache_stream_processing,,1,https://doaj.org/article/49473adc2cef44a489c601c4156cbca2,"With the increase in the amount of data captured during the manufacturing process, monitoring systems are becoming important factors in decision making for management. Current technologies such as Internet of Things (IoT)-based sensors can be considered a solution to provide efficient monitoring of the manufacturing process. In this study, a real-time monitoring system that utilizes IoT-based sensors, big data processing, and a hybrid prediction model is proposed. Firstly, an IoT-based sensor that collects temperature, humidity, accelerometer, and gyroscope data was developed. The characteristics of IoT-generated sensor data from the manufacturing process are: real-time, large amounts, and unstructured type. The proposed big data processing platform utilizes Apache Kafka as a message queue, Apache Storm as a real-time processing engine and MongoDB to store the sensor data from the manufacturing process. Secondly, for the proposed hybrid prediction model, Density-Based Spatial..."
4,Global fatal landslide occurrence from 2004 to 2016,2018,10.5194/nhess-18-2161-2018,Natural hazards and earth system sciences,review,6,unknown,,,50,https://nhess.copernicus.org/articles/18/2161/2018/nhess-18-2161-2018.pdf,"Abstract. Landslides are a ubiquitous hazard in terrestrial environments with slopes, incurring human fatalities in urban settlements, along transport corridors and at sites of rural industry. Assessment of landslide risk requires high-quality landslide databases. Recently, global landslide databases have shown the extent to which landslides impact on society and identified areas most at risk. Previous global analysis has focused on rainfall-triggered landslides over short ∼ 5-year observation periods. This paper presents spatiotemporal analysis of a global dataset of fatal non-seismic landslides, covering the period from January 2004 to December 2016. The data show that in total 55 997 people were killed in 4862 distinct landslide events. The spatial distribution of landslides is heterogeneous, with Asia representing the dominant geographical area. There are high levels of interannual variation in the occurrence of landslides. Although more active years coincide with recognised..."
4,The Version-2 Global Precipitation Climatology Project (GPCP) Monthly Precipitation Analysis (1979–Present),2003,10.1175/1525-7541(2003)004<1147:tvgpcp>2.0.co;2,Journal of Hydrometeorology,review,6,unknown,satellite_gauge_merging,GPCP; Global Precipitation Climatology Project,1,https://journals.ametsoc.org/downloadpdf/journals/hydr/4/6/1525-7541_2003_004_1147_tvgpcp_2_0_co_2.pdf,"The Global Precipitation Climatology Project (GPCP) Version-2 Monthly Precipitation Analysis is described. This globally complete, monthly analysis of surface precipitation at 2.5 latitude 2.5 longitude resolution is available from January 1979 to the present. It is a merged analysis that incorporates precipitation estimates from low-orbit satellite microwave data, geosynchronous-orbit satellite infrared data, and surface rain gauge observations. The merging approach utilizes the higher accuracy of the low-orbit microwave observations to calibrate, or adjust, the more frequent geosynchronous infrared observations. The dataset is extended back into the premicrowave era (before mid-1987) by using infrared-only observations calibrated to the microwave-based analysis of the later years. The combined satellite-based product is adjusted by the rain gauge analysis. The dataset archive also contains the individual input fields, a combined satellite estimate, and error estimates for each..."
4,Machine learning for neuroimaging with scikit-learn,2014,10.3389/fninf.2014.00014,Frontiers in Neuroinformatics,review,5,machine_learning,machine_learning,,3,https://doaj.org/article/055de24a9c3540b6b3884081362be90d,"Statistical machine learning methods are increasingly used for neuroimaging data analysis. Their main virtue is their ability to model high-dimensional datasets, e.g., multivariate analysis of activation images or resting-state time series. Supervised learning is typically used in decoding or encoding settings to relate brain images to behavioral or clinical observations, while unsupervised learning can uncover hidden structures in sets of images (e.g., resting state functional MRI) or find sub-populations in large cohorts. By considering different functional neuroimaging applications, we illustrate how scikit-learn, a Python machine learning library, can be used to perform some key analysis steps. Scikit-learn contains a very large set of statistical learning algorithms, both supervised and unsupervised, and its application to neuroimaging data provides a versatile tool to study the brain."
4,Robust mapping of spatiotemporal trajectories and cell–cell interactions in healthy and diseased tissues,2023,10.1038/s41467-023-43120-6,Nature Communications,review,5,machine_learning,,,16,https://www.nature.com/articles/s41467-023-43120-6.pdf,"Spatial transcriptomics (ST) technologies generate multiple data types from biological samples, namely gene expression, physical distance between data points, and/or tissue morphology. Here we developed three computational-statistical algorithms that integrate all three data types to advance understanding of cellular processes. First, we present a spatial graph-based method, pseudo-time-space (PSTS), to model and uncover relationships between transcriptional states of cells across tissues undergoing dynamic change (e.g. neurodevelopment, brain injury and/or microglia activation, and cancer progression). We further developed a spatially-constrained two-level permutation (SCTP) test to study cell-cell interaction, finding highly interactive tissue regions across thousands of ligand-receptor pairs with markedly reduced false discovery rates. Finally, we present a spatial graph-based imputation method with neural network (stSME), to correct for technical noise/dropout and increase ST data..."
4,Multi-decadal increase of forest burned area in Australia is linked to climate change,2021,10.1038/s41467-021-27225-4,Nature Communications,review,5,simulation_modeling,,,12,https://www.nature.com/articles/s41467-021-27225-4.pdf,"Fire activity in Australia is strongly affected by high inter-annual climate variability and extremes. Through changes in the climate, anthropogenic climate change has the potential to alter fire dynamics. Here we compile satellite (19 and 32 years) and ground-based (90 years) burned area datasets, climate and weather observations, and simulated fuel loads for Australian forests. Burned area in Australia's forests shows a linear positive annual trend but an exponential increase during autumn and winter. The mean number of years since the last fire has decreased consecutively in each of the past four decades, while the frequency of forest megafire years (>1 Mha burned) has markedly increased since 2000. The increase in forest burned area is consistent with increasingly more dangerous fire weather conditions, increased risk factors associated with pyroconvection, including fire-generated thunderstorms, and increased ignitions from dry lightning, all associated to varying degrees with..."
4,REST: A Toolkit for Resting-State Functional Magnetic Resonance Imaging Data Processing,2011,10.1371/journal.pone.0025031,PLoS ONE,review,5,regression,,,9,https://journals.plos.org/plosone/article/file?id=10.1371/journal.pone.0025031&type=printable,"Resting-state fMRI (RS-fMRI) has been drawing more and more attention in recent years. However, a publicly available, systematically integrated and easy-to-use tool for RS-fMRI data processing is still lacking. We developed a toolkit for the analysis of RS-fMRI data, namely the RESting-state fMRI data analysis Toolkit (REST). REST was developed in MATLAB with graphical user interface (GUI). After data preprocessing with SPM or AFNI, a few analytic methods can be performed in REST, including functional connectivity analysis based on linear correlation, regional homogeneity, amplitude of low frequency fluctuation (ALFF), and fractional ALFF. A few additional functions were implemented in REST, including a DICOM sorter, linear trend removal, bandpass filtering, time course extraction, regression of covariates, image calculator, statistical analysis, and slice viewer (for result visualization, multiple comparison correction, etc.). REST is an open-source package and is freely available at..."
4,MoleculeNet: a benchmark for molecular machine learning,2017,10.1039/c7sc02664a,Chemical Science,drop_or_low_priority,5,forecasting,machine_learning,MoleculeNet,2,https://github.com/newrelic/newrelic-browser-agent/blob/main/docs/warning-codes.md#,"Molecular machine learning has been maturing rapidly over the last few years. Improved methods and the presence of larger datasets have enabled machine learning algorithms to make increasingly accurate predictions about molecular properties. However, algorithmic progress has been limited due to the lack of a standard benchmark to compare the efficacy of proposed methods; most new algorithms are benchmarked on different datasets making it challenging to gauge the quality of proposed methods. This work introduces MoleculeNet, a large scale benchmark for molecular machine learning. MoleculeNet curates multiple public datasets, establishes metrics for evaluation, and offers high quality open-source implementations of multiple previously proposed molecular featurization and learning algorithms (released as part of the DeepChem open source library). MoleculeNet benchmarks demonstrate that learnable representations are powerful tools for molecular machine learning and broadly offer the best..."
