source,record_id,title,year,license,doi_dataset,doi_publication,n_files,formats,spatial_formats,total_size_mb,landing_url,first_download_url,paper_title,paper_year,abstract_available,paper_abstract_preview,task_type,modeling_signals,modeling_score,candidate_decision
dryad,63322,"Spatio-temporal analysis of remotely sensed forest loss data in the Cordillera Administrative Region, Philippines",2021,https://spdx.org/licenses/CC0-1.0.html,doi:10.5061/dryad.v41ns1rvb,,1,xlsx,,0.01,https://datadryad.org/stash/dataset/doi:10.5061/dryad.v41ns1rvb,https://datadryad.org/api/v2/files/1141211/download,,,False,,unknown,,0,review
dryad,89632,Temporal and spatial changes in benthic invertebrate trophic networks along a taxonomic richness gradient,2022,https://spdx.org/licenses/CC0-1.0.html,doi:10.5061/dryad.bk3j9kdfk,,2,"txt, xlsx",,0.73,https://datadryad.org/stash/dataset/doi:10.5061/dryad.bk3j9kdfk,https://datadryad.org/api/v2/files/1524100/download,,,False,,unknown,,0,review
dryad,49433,Data from: Assessing the usefulness of Citizen Science Data for habitat suitability modelling: opportunistic reporting versus sampling based on a systematic protocol,2021,https://spdx.org/licenses/CC0-1.0.html,doi:10.5061/dryad.8w9ghx3jj,,16,csv,,30.18,https://datadryad.org/stash/dataset/doi:10.5061/dryad.8w9ghx3jj,https://datadryad.org/api/v2/files/372529/download,,,False,,forecasting,"forecasting, regression",2,review
dryad,38933,Data from: Climate limitation at the cold edge – contrasting perspectives from species distribution modelling and a transplant experiment,2020,https://spdx.org/licenses/CC0-1.0.html,doi:10.5061/dryad.8931zcrm8,,3,"csv, txt",,0.09,https://datadryad.org/stash/dataset/doi:10.5061/dryad.8931zcrm8,https://datadryad.org/api/v2/files/211297/download,,,False,,unknown,,0,review
dryad,139788,Data from: Resource quantity and heterogeneity drive successional plant diversity in managed and unmanaged boreal forests,2025,https://spdx.org/licenses/CC0-1.0.html,doi:10.5061/dryad.2547d7x1f,,9,"md, txt, zip",,101728.85,https://datadryad.org/stash/dataset/doi:10.5061/dryad.2547d7x1f,https://datadryad.org/api/v2/files/3949644/download,,,False,,unknown,,0,review
