source,record_id,title,year,license,doi_dataset,doi_publication,n_files,formats,spatial_formats,total_size_mb,landing_url,first_download_url,paper_title,paper_year,abstract_available,paper_abstract_preview,task_type,modeling_signals,modeling_score,candidate_decision
dryad,63322,"Spatio-temporal analysis of remotely sensed forest loss data in the Cordillera Administrative Region, Philippines",2021,https://spdx.org/licenses/CC0-1.0.html,doi:10.5061/dryad.v41ns1rvb,,1,zip,,105.33,https://datadryad.org/stash/dataset/doi:10.5061/dryad.v41ns1rvb,,,,False,,unknown,,0,review
dryad,89632,Temporal and spatial changes in benthic invertebrate trophic networks along a taxonomic richness gradient,2022,https://spdx.org/licenses/CC0-1.0.html,doi:10.5061/dryad.bk3j9kdfk,,1,zip,,1.17,https://datadryad.org/stash/dataset/doi:10.5061/dryad.bk3j9kdfk,https://datadryad.org/api/v2/datasets/doi%3A10.5061%2Fdryad.bk3j9kdfk/download,,,False,,unknown,,0,review
dryad,49433,Data from: Assessing the usefulness of Citizen Science Data for habitat suitability modelling: opportunistic reporting versus sampling based on a systematic protocol,2021,https://spdx.org/licenses/CC0-1.0.html,doi:10.5061/dryad.8w9ghx3jj,,1,zip,,30.27,https://datadryad.org/stash/dataset/doi:10.5061/dryad.8w9ghx3jj,https://datadryad.org/api/v2/datasets/doi%3A10.5061%2Fdryad.8w9ghx3jj/download,,,False,,forecasting,"forecasting, regression",2,review
dryad,38933,Data from: Climate limitation at the cold edge – contrasting perspectives from species distribution modelling and a transplant experiment,2020,https://spdx.org/licenses/CC0-1.0.html,doi:10.5061/dryad.8931zcrm8,,1,zip,,0.19,https://datadryad.org/stash/dataset/doi:10.5061/dryad.8931zcrm8,https://datadryad.org/api/v2/datasets/doi%3A10.5061%2Fdryad.8931zcrm8/download,,,False,,unknown,,0,review
dryad,139788,Data from: Resource quantity and heterogeneity drive successional plant diversity in managed and unmanaged boreal forests,2025,https://spdx.org/licenses/CC0-1.0.html,doi:10.5061/dryad.2547d7x1f,,1,zip,,101728.85,https://datadryad.org/stash/dataset/doi:10.5061/dryad.2547d7x1f,,,,False,,unknown,,0,review
dryad,105916,Forest edge effects on moss growth are amplified by drought,2023,https://spdx.org/licenses/CC0-1.0.html,doi:10.5061/dryad.1g1jwsv1t,,1,zip,,1.18,https://datadryad.org/stash/dataset/doi:10.5061/dryad.1g1jwsv1t,https://datadryad.org/api/v2/datasets/doi%3A10.5061%2Fdryad.1g1jwsv1t/download,,,False,,unknown,,0,review
dryad,104233,"Data from: Contrasting long-term trends in juvenile abundance of a widespread cold-water salmonid along a latitudinal gradient: Effects of climate, stream size and migration strategy",2023,https://spdx.org/licenses/CC0-1.0.html,doi:10.5061/dryad.5tb2rbp85,,1,zip,,6.53,https://datadryad.org/stash/dataset/doi:10.5061/dryad.5tb2rbp85,https://datadryad.org/api/v2/datasets/doi%3A10.5061%2Fdryad.5tb2rbp85/download,,,False,,forecasting,forecasting,2,review
dryad,45912,Long- and short-read metabarcoding technologies reveal similar spatio-temporal structures in fungal communities,2021,https://spdx.org/licenses/CC0-1.0.html,doi:10.5061/dryad.6wwpzgmvf,,1,zip,,46.85,https://datadryad.org/stash/dataset/doi:10.5061/dryad.6wwpzgmvf,https://datadryad.org/api/v2/datasets/doi%3A10.5061%2Fdryad.6wwpzgmvf/download,,,False,,unknown,,0,review
